{"authority":{"author_contact_authorized":false,"classification":"RESEARCH_ONLY","clinical_authorization":false,"experiment_authorization":false,"merge_authorization":false,"model_fitting_authorized":false,"readiness_verdict_changed":false},"blocker":{"code":"BLOCKED_REPLICATE_SEMANTICS_UNRESOLVED","summary":"Independent experimental-unit semantics are not established by the reviewed evidence."},"decision_mapping":[{"condition":"complete source-backed semantics and sufficient independent units","outcome":"REPLICATE_GROUPING_VERIFIED"},{"condition":"source-backed semantics but too few independent units","outcome":"BLOCKED_EFFECTIVE_SAMPLE_SIZE"},{"condition":"technical grouping is documented but biological independence is not","outcome":"EXPLORATORY_ONLY_TECHNICAL_GROUPING"},{"condition":"semantics remain missing, incomplete, or contradictory","outcome":"BLOCKED_REPLICATE_SEMANTICS_UNRESOLVED"}],"forbidden_substitutions":["plate, well, index pair, sequencing run, Date, or Probe diversity without source-backed semantics","individual cells counted as independent replicates without evidence","random cell split presented as generalization evidence","grouping selected after viewing response values or model performance","sample-name patterns treated as experimental-unit evidence by themselves","synthetic or foundation-model output treated as replicate evidence"],"limitations":["The planner identifies missing evidence but does not infer biological facts.","The planner does not contact authors or accept evidence automatically.","Generating a plan does not change the source readiness verdict.","No model fitting, experiment, clinical action, or merge is authorized."],"next_action":"Collect immutable source-backed answers for every required evidence item; do not change the readiness verdict until they are reviewed.","plan_status":"OPEN_EVIDENCE_REQUEST","required_evidence":[{"acceptable_sources":["PUBLIC_AUTHOR_CLARIFICATION","IMMUTABLE_SUPPLEMENTARY_METHODS","PINNED_PROTOCOL","MACHINE_READABLE_METADATA_WITH_SEMANTICS","VERSIONED_LAB_DOCUMENTATION"],"blocking_if_missing":true,"id":"independent_unit_definition","minimum_content":["physical and experimental definition of one unit","statement of whether units reflect cultures, days, imaging sessions, or another design level"],"question":"What is the independent experimental unit for this cohort?"},{"acceptable_sources":["PUBLIC_AUTHOR_CLARIFICATION","IMMUTABLE_SUPPLEMENTARY_METHODS","PINNED_PROTOCOL","MACHINE_READABLE_METADATA_WITH_SEMANTICS","VERSIONED_LAB_DOCUMENTATION"],"blocking_if_missing":true,"id":"sample_to_unit_mapping","minimum_content":["complete mapping for every selected sample ID","stable unit identifiers with no inferred gaps"],"question":"How does every selected sample map to an independent unit?"},{"acceptable_sources":["PUBLIC_AUTHOR_CLARIFICATION","IMMUTABLE_SUPPLEMENTARY_METHODS","PINNED_PROTOCOL","MACHINE_READABLE_METADATA_WITH_SEMANTICS","VERSIONED_LAB_DOCUMENTATION"],"blocking_if_missing":true,"id":"dependency_disclosure","minimum_content":["all known shared dependencies","rules for keeping dependent observations in one split group"],"question":"Which samples share cultures, days, imaging sessions, extractions, or repeated measurements?"},{"acceptable_sources":["PUBLIC_AUTHOR_CLARIFICATION","IMMUTABLE_SUPPLEMENTARY_METHODS","PINNED_PROTOCOL","MACHINE_READABLE_METADATA_WITH_SEMANTICS","VERSIONED_LAB_DOCUMENTATION"],"blocking_if_missing":true,"id":"technical_label_semantics","minimum_content":["explicit semantics for each proposed grouping label","clear separation of technical labels from biological replication"],"question":"What do plate, well, index, sequencing-run, Date, Probe, and sample-name labels represent?"},{"acceptable_sources":["PUBLIC_AUTHOR_CLARIFICATION","IMMUTABLE_SUPPLEMENTARY_METHODS","PINNED_PROTOCOL","MACHINE_READABLE_METADATA_WITH_SEMANTICS","VERSIONED_LAB_DOCUMENTATION"],"blocking_if_missing":true,"id":"effective_unit_count","minimum_content":["effective independent-unit count","derivation from the complete sample-to-unit mapping"],"question":"How many independent units remain after all dependencies are grouped?"},{"acceptable_sources":["PUBLIC_AUTHOR_CLARIFICATION","IMMUTABLE_SUPPLEMENTARY_METHODS","PINNED_PROTOCOL","MACHINE_READABLE_METADATA_WITH_SEMANTICS","VERSIONED_LAB_DOCUMENTATION"],"blocking_if_missing":true,"id":"held_out_split_recommendation","minimum_content":["split unit defined before model fitting","statement on whether leave-one-plate-out is confirmatory or only exploratory"],"question":"Which held-out split is scientifically defensible for this cohort?"}],"schema":"kairos.evidence-request-plan.v0.1","source_result":{"adapter":"live-seq-gse141064","dataset_id":"GSE141064","dataset_version":"pinned-public-inputs-v0.1","schema":"kairos.dataset-readiness-result.v0.1","sha256":"sha256:782d496f62dd49a073d2302dfe784befe8909e6a70d8bee55ca8556ee552a7a6","status":"BLOCKED_REPLICATE_SEMANTICS_UNRESOLVED"}}
